rank,name,code,score,market,sector,changeRate,entryPrice,stopLoss,targetPrice,strategy,weeklyCloud,dailySignal,rsi,macd,volumeSignal,reason
1,한화시스템,272210,86,KOSPI,방산/우주항공,-,눌림목 확인,20일선 이탈,분할 익절,20일선 지지 확인 후 분할 접근,주봉 구름대 상단 유지 확인,20일선 지지 확인,중립,상승 전환 확인,거래량 동반 확인,방산·우주항공 모멘텀 점검 후보
2,삼성전자,005930,84,KOSPI,반도체,-,조건 확인,기준 확인,분할 익절,반도체 업황과 외국인 수급 동시 확인,구름대 회복 확인,이평선 회복 확인,중립,중립,거래량 회복 확인,반도체 대표주 수급 점검 후보
3,한화오션,042660,83,KOSPI,조선/방산,-,눌림목 확인,전저점 이탈,분할 익절,수주 뉴스와 수급 동반 확인,상단 유지 확인,단기 이격 조정 확인,중립,상승 유지 확인,거래량 유지 확인,방산·조선 수주 모멘텀 점검 후보
4,두산에너빌리티,034020,81,KOSPI,원전/에너지,-,조건 확인,20일선 이탈,분할 익절,정책 모멘텀과 수급 확인 후 접근,구름대 상단 확인,20일선 지지 확인,중립,중립,거래량 확인,원전·에너지 정책 모멘텀 점검 후보
5,로보티즈,108490,78,KOSDAQ,로봇,-,관찰,전저점 이탈,분할 익절,급등 추격보다 눌림목 관찰,구름대 접근,변동성 확대,과열 확인 필요,상승 둔화,거래량 급증 후 감소 확인,로봇 테마 변동성 점검 후보
